[
  {
    "id": "agenteval",
    "name": "AgentEval",
    "stage": "toolchain",
    "subcategory": "harness",
    "what": "Provide a harness for evaluating AI agent task performance",
    "type": "tool",
    "repo": "https://github.com/AgentEvalHQ/AgentEval",
    "stars": 86,
    "tags": [
      "evaluation-framework",
      "dotnet",
      "tool-use-validation",
      "rag-metrics",
      "model-comparison"
    ],
    "added_date": "2026-04-29",
    "last_verified": "2026-04-29",
    "status": "active",
    "languages": [
      "c#"
    ],
    "related": {
      "benchmarks": [
        "web2code-a-large-scale-webpage-to-code-dataset-and-evaluation-framework-for-multimodal-llms"
      ]
    }
  },
  {
    "id": "agentkernelarena",
    "name": "AgentKernelArena",
    "stage": "toolchain",
    "subcategory": "sandbox",
    "what": "Isolated sandbox for side-by-side benchmarking of SE agents on kernel tasks",
    "type": "tool",
    "repo": "https://github.com/AMD-AGI/AgentKernelArena",
    "stars": 13,
    "tags": [
      "sandbox",
      "side-by-side-evaluation",
      "multi-agent",
      "benchmarking",
      "kernel-development"
    ],
    "added_date": "2026-04-29",
    "last_verified": "2026-04-29",
    "status": "active",
    "languages": [
      "python"
    ],
    "related": {
      "benchmarks": [
        "agent-security-bench-asb-formalizing-and-benchmarking-attacks-and-defenses-in-llm-based-agents",
        "autobaxbuilder-bootstrapping-code-security-benchmarking",
        "benchmarking-agentic-code-reasoning-at-the-repository-level",
        "benchmarking-and-studying-the-llm-based-agent-system-in-end-to-end-software-development",
        "benchmarking-and-studying-the-llm-based-code-review",
        "benchmarking-coding-agents-in-long-horizon-software-evolution-scenarios",
        "contextcrbench",
        "benchmarking-llms-for-unit-test-generation-from-real-world-functions",
        "beyond-correctness-benchmarking-multi-dimensional-code-generation-for-large-language-models",
        "beyond-output-correctness-benchmarking-and-evaluating-large-language-model-reasoning-in-coding-tasks",
        "bigcodebench-benchmarking-code-generation-with-diverse-function-calls-and-complex-instructions",
        "bug-report-driven-fault-localization-industrial-benchmarking-and-lesson-learned-at-abb-robotics",
        "cadmas-ctx-contextual-capability-calibration-for-multi-agent-delegation",
        "cetbench-a-novel-dataset-constructed-via-transformations-over-programs-for-benchmarking-llms-for-code-equivalence-checki",
        "codeassistbench-cab-dataset-amp-benchmarking-for-multi-turn-chat-based-code-assistance",
        "codegeex-a-pre-trained-model-for-code-generation-with-multilingual-benchmarking-on-humaneval-x",
        "codemenv-benchmarking-large-language-models-on-code-migration",
        "codespecbench-benchmarking-llms-for-executable-behavioral-specification-generation",
        "codeupdatearena-benchmarking-knowledge-editing-on-api-updates"
      ]
    }
  },
  {
    "id": "agentrun",
    "name": "AgentRun",
    "stage": "toolchain",
    "subcategory": "sandbox",
    "what": "Python library for running AI-generated code safely in Docker sandboxes",
    "type": "paper",
    "tags": [
      "sandbox",
      "code-execution",
      "docker",
      "python",
      "safety"
    ],
    "added_date": "2026-04-30",
    "last_verified": "2026-04-30",
    "status": "active",
    "repo": "https://github.com/Jonathan-Adly/AgentRun",
    "related": {
      "benchmarks": [
        "an-llm-based-agent-for-reliable-docker-environment-configuration",
        "benchmarks-for-trajectory-safety-evaluation-and-diagnosis-in-openclaw-and-codex-atbench-claw-and-atbench-codex",
        "bugsinpy-a-database-of-existing-bugs-in-python-programs-to-enable-controlled-testing-and-debugging-studies",
        "clawsbench-evaluating-capability-and-safety-of-llm-productivity-agents-in-simulated-workspaces",
        "from-translation-to-superset-benchmark-driven-evolution-of-a-production-ai-agent-from-rust-to-python",
        "multi-docker-eval-a-shovel-of-the-gold-rush-benchmark-on-automatic-environment-building-for-software-engineering",
        "os-spear-a-toolkit-for-the-safety-performance-efficiency-and-robustness-analysis-of-os-agents",
        "python-code-generation-by-asking-clarification-questions",
        "redcode-risky-code-execution-and-generation-benchmark-for-code-agents"
      ]
    }
  },
  {
    "id": "braintrust",
    "name": "Braintrust",
    "stage": "toolchain",
    "subcategory": "observability",
    "what": "Provide eval, logging, and observability for LLM applications",
    "type": "tool",
    "website": "https://braintrust.dev",
    "tags": [
      "observability",
      "agent-eval",
      "experiment-tracking",
      "llm-as-judge",
      "commercial"
    ],
    "added_date": "2026-04-29",
    "last_verified": "2026-04-29",
    "status": "active"
  },
  {
    "id": "build-reliable-ai-agents-with-amazon-bedrock-agentcore-evaluations",
    "name": "Build reliable AI agents with Amazon Bedrock AgentCore Evaluations",
    "stage": "toolchain",
    "subcategory": "harness",
    "what": "AWS blog on evaluating AI agents using Amazon Bedrock AgentCore Evaluations",
    "type": "paper",
    "tags": [
      "aws",
      "bedrock",
      "agent-evaluation",
      "cloud-platform",
      "toolchain"
    ],
    "added_date": "2026-04-30",
    "last_verified": "2026-04-30",
    "status": "active",
    "website": "https://aws.amazon.com/blogs/machine-learning/build-reliable-ai-agents-with-amazon-bedrock-agentcore-evaluations/",
    "related": {
      "benchmarks": [
        "clawsbench-evaluating-capability-and-safety-of-llm-productivity-agents-in-simulated-workspaces"
      ]
    }
  },
  {
    "id": "catarena",
    "name": "CATArena",
    "stage": "toolchain",
    "subcategory": "harness",
    "what": "Tournament platform for code agents via iterative competitive peer learning",
    "type": "repo",
    "repo": "https://github.com/AGI-Eval-Official/CATArena",
    "stars": 64,
    "tags": [
      "code-agent",
      "tournament-evaluation",
      "competitive-learning",
      "benchmark-platform",
      "llm-agent"
    ],
    "added_date": "2026-04-29",
    "last_verified": "2026-04-29",
    "status": "active",
    "languages": [
      "python"
    ],
    "related": {
      "benchmarks": [
        "a-benchmark-for-evaluating-repository-level-code-agents-with-intermediate-reasoning-on-feature-addition-task",
        "an-interactive-benchmark-for-llm-agents-in-long-context-software-engineering",
        "awesome-code-agents",
        "benchguard-who-guards-the-benchmarks-automated-auditing-of-llm-agent-benchmarks",
        "beyond-pip-install-evaluating-llm-agents-for-the-automated-installation-of-python-projects",
        "breakpoint-scalable-evaluation-of-system-level-reasoning-in-llm-code-agents",
        "catarena-evaluating-evolutionary-capabilities-of-code-agents-via-iterative-tournaments",
        "codeagent-autonomous-communicative-agents-for-code-review",
        "codeagent-enhancing-code-generation-with-tool-integrated-agent-systems-for-real-world-repo-level-coding-challenges",
        "continuous-benchmark-generation-for-evaluating-enterprise-scale-llm-agents",
        "cujbench-benchmarking-llm-agent-on-cross-modal-failure-diagnosis-from-browser-to-backend",
        "da-code-agent-data-science-code-generation-benchmark-for-large-language-models",
        "datascibench-an-llm-agent-benchmark-for-data-science",
        "executable-code-actions-elicit-better-llm-agents",
        "gittaskbench-a-benchmark-for-code-agents-solving-real-world-tasks-through-code-repository-leveraging",
        "hwe-bench-benchmarking-llm-agents-on-real-world-hardware-bug-repair-tasks",
        "joycode-agent",
        "locagent-graph-guided-llm-agents-for-code-localization",
        "multiagentbench-evaluating-the-collaboration-and-competition-of-llm-agents",
        "prdbench"
      ]
    }
  },
  {
    "id": "code-runner-sandbox",
    "name": "Code-Runner-Sandbox",
    "stage": "toolchain",
    "subcategory": "sandbox",
    "what": "Multi-language code execution sandbox (Python/Java/C/Go) for model evaluation",
    "type": "tool",
    "repo": "https://github.com/shouldnotappearcalm/Code-Runner-Sandbox",
    "stars": 23,
    "tags": [
      "sandbox",
      "code-execution",
      "multi-language",
      "open-r1",
      "runtime-environment"
    ],
    "added_date": "2026-04-29",
    "last_verified": "2026-04-29",
    "status": "active",
    "languages": [
      "python"
    ],
    "related": {
      "benchmarks": [
        "effibench-x-a-multi-language-benchmark-for-measuring-efficiency-of-llm-generated-code",
        "redcode-risky-code-execution-and-generation-benchmark-for-code-agents",
        "swe-polybench-a-multi-language-benchmark-for-repository-level-evaluation-of-coding-agents"
      ]
    }
  },
  {
    "id": "codetracer-towards-traceable-agent-states",
    "name": "CodeTracer: Towards Traceable Agent States",
    "stage": "toolchain",
    "subcategory": "observability",
    "what": "Provide tracing and observability for coding agent states",
    "type": "paper",
    "tags": [
      "observability",
      "agent-debugging",
      "state-tracing",
      "error-chain",
      "code-agent"
    ],
    "added_date": "2026-04-29",
    "last_verified": "2026-04-29",
    "status": "active",
    "paper": "https://arxiv.org/abs/2604.11641",
    "related": {
      "benchmarks": [
        "a-benchmark-for-evaluating-repository-level-code-agents-with-intermediate-reasoning-on-feature-addition-task",
        "awesome-code-agents",
        "breakpoint-scalable-evaluation-of-system-level-reasoning-in-llm-code-agents",
        "catarena-evaluating-evolutionary-capabilities-of-code-agents-via-iterative-tournaments",
        "codeagent-autonomous-communicative-agents-for-code-review",